<?xml version="1.0" encoding="UTF-8"?>
<schema targetNamespace="http://github.com/HudsonLiang/roadrotation" elementFormDefault="unqualified" xmlns="http://www.w3.org/2001/XMLSchema" xmlns:tns="http://github.com/HudsonLiang/roadrotation">



    <element name="Rules">
    	<complexType>
    		<sequence>
    			<element name="WeekDayRule" type="tns:WeekDayRuleType" maxOccurs="unbounded" minOccurs="1"></element>
    		</sequence>
    	</complexType></element>

    <complexType name="WeekDayRuleType">
    	<sequence>
    		<element name="WeekDaySequence" minOccurs="1" maxOccurs="5">
    			<simpleType>
    				<restriction base="string"></restriction>
    			</simpleType>
    		</element>
    	</sequence>
    	<attribute name="onDate" type="date" use="required"></attribute>
    	<attribute name="offDate" type="date" use="required"></attribute>
    </complexType>

    <complexType name="BaseRuleType"></complexType>
</schema>